end, ['For all your servicing and repair requirements, call the friendly team at AC AutoBRAKESCan’t quite figure out the source of that squealing?', 'We want you back on the road as soon as possible, and our friendly team is dedicated to helping you get there.Email: acauto.email@gmail.comPhone: 781-621-8151home: Monday – Friday: 8:00 AM – 6:00 PM\xa0Brought my ford focus to get a front ball joint replaced, the mechanic Ryan took real nice care of my car and put my mind at ease about the whole process.', 'Friendly, honest and helpful staff with many years experience.', 'Highly recommended.', 'I have been going to these guys since my friend Julie introduced me to them years ago.', "It's hard to find the combination of an auto mechanic you can trust whose pricing is fair and whose work is outstanding!− Joyce Harty\xa0\xa0When was the last time car repairs ended up costing less than you had anticipated?", 'Highly recommend.− Julia\xa0\xa0Been working with AC Auto for as long as I have lived in the area - 12 years.', 'For my family and myself, they are a God send.', "View on facebook                       \t\t\t\t1 year ago\t\t\t         Photos from AC Auto's post \t\t\t\t\t\t\t\t\t\t\t\t\t\tSub Frame swaps all weekend.", '\\\\ud83d\\\\ude1c\\",\\"comment_count\\":2,\\"id\\":\\"2567796679912979_2569537339738913\\"}],\\"paging\\":{\\"cursors\\":{\\"before\\":\\"WTI5dGJXVnVkRjlqZAFhKemIzSTZANalUyTnpneE1EQXpPVGt4TVRZAME16b3hOVE15TWpJek9UTTEZD\\",\\"after\\":\\"WTI5dGJXVnVkRjlqZAFhKemIzSTZANalUyT1RVek56TXpPVGN6T0RreE16b3hOVE15TWpnM09ERTAZD\\"}},\\"summary\\":{\\"order\\":\\"chronological\\",\\"total_count\\":7,\\"can_comment\\":false}},\\"attachments\\":{\\"media\\":{\\"image\\":{\\"height\\":405,\\"src\\":\\"https:\\\\/\\\\/scontent.xx.fbcdn.net\\\\/v\\\\/t15.0-10\\\\/s720x720\\\\/12419585_10154327819997792_1853170539_n.jpg?_nc_cat=0&oh=792330b4435f2bf89391ebe78405c08a&oe=5BD3B362\\",\\"width\\":720}},\\"type\\":\\"video_inline\\"},\\"shares\\":{\\"count\\":1},\\"who_post\\":{\\"picture\\":{\\"data\\":{\\"height\\":50,\\"is_silhouette\\":false,\\"url\\":\\"https:\\\\/\\\\/scontent.xx.fbcdn.net\\\\/v\\\\/t1.0-1\\\\/c18.18.230.230\\\\/s50x50\\\\/67532_650486158310717_606530372_n.jpg?_nc_cat=0&oh=68123898fb53cd2e3b109f6889bcc2f9&oe=5C041DB5\\",\\"width\\":50}},\\"name\\":\\"AC Auto\\",\\"link\\":\\"https:\\\\/\\\\/www.facebook.com\\\\/ACAutoWakefield\\\\/\\",\\"id\\":\\"114478575244814\\"}},{\\"id\\":\\"257\\",\\"type\\":\\"link\\",\\"object_id\\":\\"114478575244814_2561218643904116\\",\\"from\\":\\"114478575244814\\",\\"story\\":\\"AC Auto shared a link.\\",\\"place\\":null,\\"message_tags\\":null,\\"with_tags\\":null,\\"story_tags\\":[{\\"id\\":\\"114478575244814\\",\\"name\\":\\"AC Auto\\",\\"type\\":\\"page\\",\\"offset\\":0,\\"length\\":7}],\\"comments\\":{\\"data\\":[{\\"created_time\\":\\"2018-07-19T04:08:54+0000\\",\\"like_count\\":0,\\"message\\":\\"I wish Dick&#039;s sporting goods did that for me or Lyft too #crownvicisdone2018\\",\\"comment_count\\":0,\\"id\\":\\"2561218643904116_2561427297216584\\"}],\\"paging\\":{\\"cursors\\":{\\"before\\":\\"WTI5dGJXVnVkRjlqZAFhKemIzSTZANalUyTVRReU56STVOekl4TmpVNE5Eb3hOVE14T1Rjek16TTAZD\\",\\"after\\":\\"WTI5dGJXVnVkRjlqZAFhKemIzSTZANalUyTVRReU56STVOekl4TmpVNE5Eb3hOVE14T1Rjek16TTAZD\\"}},\\"summary\\":{\\"order\\":\\"chronological\\",\\"total_count\\":1,\\"can_comment\\":false}},\\"attachments\\":{\\"media\\":{\\"image\\":{\\"height\\":630,\\"src\\":\\"https:\\\\/\\\\/scontent.xx.fbcdn.net\\\\/v\\\\/t45.1600-4\\\\/c34.0.630.630\\\\/p640x640\\\\/37166688_23842908892450567_5938098054031736832_n.png?_nc_cat=0&oh=9a9090c11403073d5d0dff1ce1598de1&oe=5C12BA99\\",\\"width\\":630}},\\"type\\":\\"share\\"},\\"shares\\":null,\\"who_post\\":{\\"picture\\":{\\"data\\":{\\"height\\":50,\\"is_silhouette\\":false,\\"url\\":\\"https:\\\\/\\\\/scontent.xx.fbcdn.net\\\\/v\\\\/t1.0-1\\\\/c18.18.230.230\\\\/s50x50\\\\/67532_650486158310717_606530372_n.jpg?_nc_cat=0&oh=68123898fb53cd2e3b109f6889bcc2f9&oe=5C041DB5\\",\\"width\\":50}},\\"name\\":\\"AC Auto\\",\\"link\\":\\"https:\\\\/\\\\/www.facebook.com\\\\/ACAutoWakefield\\\\/\\",\\"id\\":\\"114478575244814\\"}}]\',\t\t\t\t\t\t\t\t\t\t\tgraph_url_0 = \'https://graph.facebook.com/{FB_ID}/{EDGE}?access_token=1907658946156725|772c0f8e45a3e7ce70e66a93763e3c1e&{FIELDS}{OTHER}\';\t\t\t\t\t\t\t\t\t\tffwd_fill_likes_blog_style(JSON.parse(id_object_id_0), \'0\', owner_info_0, ffwd_params_0, graph_url_0);\t\t\t\t\t\t\t\t\t     \t\t\t\tfunction spider_page_0(cur, x, y, load_more) {\t\t\t\t\tif (typeof load_more == "undefined") {\t\t\t\t\t\tvar load_more = false;\t\t\t\t\t}\t\t\t\t\tif (jQuery(cur).hasClass(\'disabled\')) {\t\t\t\t\t\treturn false;\t\t\t\t\t}\t\t\t\t\tvar items_county_0 = 1;\t\t\t\t\tswitch (y) {\t\t\t\t\t\tcase 1:\t\t\t\t\t\t\tif (x >= items_county_0) {\t\t\t\t\t\t\t\tdocument.getElementById(\'page_number_0\').value = items_county_0;\t\t\t\t\t\t\t}\t\t\t\t\t\t\telse {\t\t\t\t\t\t\t\tdocument.getElementById(\'page_number_0\').value = x + 1;\t\t\t\t\t\t\t}\t\t\t\t\t\t\tbreak;\t\t\t\t\t\tcase 2:\t\t\t\t\t\t\tdocument.getElementById(\'page_number_0\').value = items_county_0;\t\t\t\t\t\t\tbreak;\t\t\t\t\t\tcase -1:\t\t\t\t\t\t\tif (x == 1) {\t\t\t\t\t\t\t\tdocument.getElementById(\'page_number_0\').value = 1;\t\t\t\t\t\t\t}\t\t\t\t\t\t\telse {\t\t\t\t\t\t\t\tdocument.getElementById(\'page_number_0\').value = x - 1;\t\t\t\t\t\t\t}\t\t\t\t\t\t\tbreak;\t\t\t\t\t\tcase -2:\t\t\t\t\t\t\tdocument.getElementById(\'page_number_0\').value = 1;\t\t\t\t\t\t\tbreak;\t\t\t\t\t\tdefault:\t\t\t\t\t\t\tdocument.getElementById(\'page_number_0\').value = 1;\t\t\t\t\t}\t\t\t\t\tffwd_frontend_ajax(\'ffwd_front_form_0\', \'0\', \'ffwd_standart_objcets_cont_0\', \'0\', \'\', \'album\', 0, \'\', \'\', load_more);\t\t\t\t}\t\t\t\tjQuery(document).ready(function() {\t\t\t\t\tjQuery(\'.first-page-0\').on(\'click\', function() {\t\t\t\t\t\tspider_page_0(this, 1, -2);\t\t\t\t\t});\t\t\t\t\tjQuery(\'.prev-page-0\').on(\'click\', function() {\t\t\t\t\t\tspider_page_0(this, 1, -1);\t\t\t\t\t\treturn false;\t\t\t\t\t});\t\t\t\t\tjQuery(\'.next-page-0\').on(\'click\', function() {\t\t\t\t\t\tspider_page_0(this, 1, 1);\t\t\t\t\t\treturn false;\t\t\t\t\t});\t\t\t\t\tjQuery(\'.last-page-0\').on(\'click\', function() {\t\t\t\t\t\tspider_page_0(this, 1, 2);\t\t\t\t\t});\t\t\t\t\tjQuery(\'.ffwd_load_btn_0\').on(\'click\', function() {\t\t\t\t\t\tspider_page_0(this, 1, 1, true);\t\t\t\t\t\treturn false;\t\t\t\t\t});\t\t\t\t});\t\t\t         \t\t\tfunction ffwd_gallery_box_0(image_id) {\t\t\t\tffwd_createpopup(\'https://acautoma.com/wp-admin/admin-ajax.php?action=PopupBox&current_view=0&fb_id=1&theme_id=0&open_with_fullscreen=0&open_with_autoplay=0&image_width=800&image_height=600&image_effect=fade&enable_image_filmstrip=0&image_filmstrip_height=70&enable_comments=1&enable_likes=1&enable_shares=1&enable_author=1&enable_name=1&enable_place_name=1&enable_message_desc=1&enable_image_ctrl_btn=1&enable_image_fullscreen=1&enable_object_info=0&slideshow_interval=5&enable_image_facebook=0&enable_image_twitter=0&enable_image_google=0&current_url&image_id=257&image_id=\' + image_id + \'&content_type=timeline\', \'0\', \'800\', \'600\', 1, \'testpopup\', 5);\t\t\t}\t\t\tfunction ffwd_document_ready_0() {\t\t\t\t\t\t\t\tjQuery("body").on("click", ".ffwd_lightbox_0", function () {\t\t\t\t    if(jQuery(this).attr("data-type")==\'video\')                    {                        return true;                    }\t\t\t\t\tffwd_gallery_box_0(jQuery(this).attr("data-id"));\t\t\t\t\treturn false;\t\t\t\t});\t\t\t\t\t\t\t}\t\t\tjQuery(document).ready(function () {\t\t\t\tffwd_document_ready_0();\t\t\t\tjQuery(\'body\').on(\'click\', \'.ffwd_see_more_message\', function(e) {\t\t\t\t\te.preventDefault();\t\t\t\t\tjQuery(this).parent().find(\'.ffwd_blog_style_object_message_hide\').css(\'display\', \'inline\');\t\t\t\t\tjQuery(this).html(\'See less\').removeClass(\'ffwd_see_more_message\').addClass(\'ffwd_see_less_message\');\t\t\t\t\tjQuery(this).parent().find(\'.more_dotes\').css(\'display\', \'none\');\t\t\t\t});\t\t\t\tjQuery(\'body\').on(\'click\', \'.ffwd_see_less_message\', function(e) {\t\t\t\t\te.preventDefault();\t\t\t\t\tjQuery(this).parent().find(\'.ffwd_blog_style_object_message_hide\').css(\'display\', \'none\');\t\t\t\t\tjQuery(this).html(\'See more\').removeClass(\'ffwd_see_less_message\').addClass(\'ffwd_see_more_message\');\t\t\t\t\tjQuery(this).parent().find(\'.more_dotes\').css(\'display\', \'inline\');\t\t\t\t});\t\t\t\tjQuery(\'body\').on(\'click\', \'.ffwd_see_more_description\', function(e) {\t\t\t\t\te.preventDefault();\t\t\t\t\tjQuery(this).parent().find(\'.ffwd_blog_style_object_description_hide\').css(\'display\', \'inline\');\t\t\t\t\tjQuery(this).html(\'See less\').removeClass(\'ffwd_see_more_description\').addClass(\'ffwd_see_less_description\');\t\t\t\t\tjQuery(this).parent().find(\'.more_dotes\').css(\'display\', \'none\');\t\t\t\t});\t\t\t\tjQuery(\'body\').on(\'click\', \'.ffwd_see_less_description\', function(e) {\t\t\t\t\te.preventDefault();\t\t\t\t\tjQuery(this).parent().find(\'.ffwd_blog_style_object_description_hide\').css(\'display\', \'none\');\t\t\t\t\tjQuery(this).html(\'See more\').removeClass(\'ffwd_see_less_description\').addClass(\'ffwd_see_more_description\');\t\t\t\t\tjQuery(this).parent().find(\'.more_dotes\').css(\'display\', \'inline\');\t\t\t\t});\t\t\t\tjQuery(\'body\').on(\'click\', \'.ffwd_view_more_comments\', function(e) {\t\t\t\t\te.preventDefault();\t\t\t\t\tjQuery(this).parent().parent().parent().find(\'.ffwd_comment_0\').css(\'display\', \'block\');\t\t\t\t\tjQuery(this).html(\'\');\t\t\t\t});\t\t\t\tjQuery(\'body\').on(\'click\', \'.ffwd_comment_replies_label_0\', function(e) {\t\t\t\t\te.preventDefault();\t\t\t\t\tjQuery(this).parent().find(\'.ffwd_comment_replies_content_0\').css(\'display\', \'block\');\t\t\t\t\tjQuery(this).remove();\t\t\t\t});\t\t\t\tjQuery(\'body\').on(\'click\', \'.ffwd_view_on_facebook_0\', function(e) {\t\t\t\t\te.stopPropagation();\t\t\t\t});\t\t\t\tjQuery(\'body\').on(\'click\', \'.ffwd_title_spun1_0\', function(e) {\t\t\t\t\te.preventDefault();\t\t\t\t\tvar ffwd_comments = jQuery(this).parent().find(\'.ffwd_comments_0\');\t\t\t\t\tif(ffwd_comments.children().length == 0) return;\t\t\t\t\tif(ffwd_comments.css(\'display\') == \'none\')\t\t\t\t\t\tffwd_comments.slideDown(500);\t\t\t\t\telse\t\t\t\t\t\tffwd_comments.slideUp(500);\t\t\t\t});\t\t\t\tjQuery(\'body\').on(\'click\', \'.ffwd_share_button_0\', function(e) {\t\t\t\t\te.stopPropagation();\t\t\t\t});\t\t\t\tjQuery(window).resize(function() {\t\t\t\t\tffwd_blog_style_resize(ffwd_params_0, \'0\')\t\t\t\t});\t\t\t});\t\t                                                          NASA is reinventing the wheel for space and it\'s wild.', 'Sub Frame swaps all weekend.']
save, ['Definitely will bring my car back in the future for any repairs needed!− Andrew Kent\xa0\xa0John and the crew have not only fixed my car, they saved me money on the job.', 'They are always upfront with the costs and if they can save me money they do.']
shop, ['Best shop around!', 'Really nice guys in the shop, upfront about costs and timing.', "The shop is set back behind their parking lot so it's a little hard to find but it's there!", 'Brought it here, and Mark fixed it for me right away, unlike people at other nearby shop, where I stopped earlier.', 'I left a repair place I was using for 20 years and now see me using AC Auto for the next 20. fair shop rates and no extra charges has been my experience so far.− David\xa0\xa0AC Autos the best.', 'View on facebook                       \t\t\t\t1 year ago\t\t\t          \t\t\t\t\t\t\t\t\t\t\t\t\t\tAC Auto is an all makes and all models repair shop specializing in getting your car or truck back to you fixed as fast as possible.', 'AC Auto is an all makes and all models repair shop specializing in getting your car or truck back to you fixed as fast as possible.', 'All other locations are open from 7:30AM to 5:00 PM Weekdays and 8:00 AM to 5:00 PM on Saturdays.We thank you for selecting Gem Auto parts for your auto parts needs and look forward to a prosperous business relationship for the both of us.If you are in the business of auto repair or auto body repair and you would like to register to shop on line, call Jesse Kaplan at 617-569-2288 ext.', '<!--\ndocument.form.nexpartuname.value = readCookie("theName");\ndocument.form.pwd.value = readCookie("thePwd");\n//-->\n\n\r\nGEM AUTO PARTS\r\nWhatever It Takes\r\n© Gem Auto Parts\r\n7 Griffin Way\r\nChelsea, MA\r\n(617) 884-7400 - 1 (866) 884-7400\n\nHOME\nCOMPANY\nLOCATIONS\nPRODUCT LINES \nAUTO BODY SUPPLIES\nSHOP SUPPLIES\nTRAINING\nLINKS\nVIDEOWebsite Designed by Standing Stone Designs, Inc.Hosted by Ashdown Technologies, Inc. For Expert Collision Repair and Auto Body services North of Boston-MA, no other shop can compare to Precision Auto Works.', 'We are trusted by a full range of outstanding customers in Wakefield and the surrounding towns and work on all makes and models.AUTO ACCIDENTS ARE STRESSFUL.Precision Auto Works is here for you.need a tow?Precision Auto Works provides expert collision repair and auto body services North of Boston-MA\xa0that no other shop can compare too.', 'We are an automotive repair shop and have been in business for 54 years.']
last, ['I bought my last car from them and plan to buy my next one from them.', "It's hard to find the combination of an auto mechanic you can trust whose pricing is fair and whose work is outstanding!− Joyce Harty\xa0\xa0When was the last time car repairs ended up costing less than you had anticipated?", '\\\\ud83d\\\\ude1c\\",\\"comment_count\\":2,\\"id\\":\\"2567796679912979_2569537339738913\\"}],\\"paging\\":{\\"cursors\\":{\\"before\\":\\"WTI5dGJXVnVkRjlqZAFhKemIzSTZANalUyTnpneE1EQXpPVGt4TVRZAME16b3hOVE15TWpJek9UTTEZD\\",\\"after\\":\\"WTI5dGJXVnVkRjlqZAFhKemIzSTZANalUyT1RVek56TXpPVGN6T0RreE16b3hOVE15TWpnM09ERTAZD\\"}},\\"summary\\":{\\"order\\":\\"chronological\\",\\"total_count\\":7,\\"can_comment\\":false}},\\"attachments\\":{\\"media\\":{\\"image\\":{\\"height\\":405,\\"src\\":\\"https:\\\\/\\\\/scontent.xx.fbcdn.net\\\\/v\\\\/t15.0-10\\\\/s720x720\\\\/12419585_10154327819997792_1853170539_n.jpg?_nc_cat=0&oh=792330b4435f2bf89391ebe78405c08a&oe=5BD3B362\\",\\"width\\":720}},\\"type\\":\\"video_inline\\"},\\"shares\\":{\\"count\\":1},\\"who_post\\":{\\"picture\\":{\\"data\\":{\\"height\\":50,\\"is_silhouette\\":false,\\"url\\":\\"https:\\\\/\\\\/scontent.xx.fbcdn.net\\\\/v\\\\/t1.0-1\\\\/c18.18.230.230\\\\/s50x50\\\\/67532_650486158310717_606530372_n.jpg?_nc_cat=0&oh=68123898fb53cd2e3b109f6889bcc2f9&oe=5C041DB5\\",\\"width\\":50}},\\"name\\":\\"AC Auto\\",\\"link\\":\\"https:\\\\/\\\\/www.facebook.com\\\\/ACAutoWakefield\\\\/\\",\\"id\\":\\"114478575244814\\"}},{\\"id\\":\\"257\\",\\"type\\":\\"link\\",\\"object_id\\":\\"114478575244814_2561218643904116\\",\\"from\\":\\"114478575244814\\",\\"story\\":\\"AC Auto shared a link.\\",\\"place\\":null,\\"message_tags\\":null,\\"with_tags\\":null,\\"story_tags\\":[{\\"id\\":\\"114478575244814\\",\\"name\\":\\"AC Auto\\",\\"type\\":\\"page\\",\\"offset\\":0,\\"length\\":7}],\\"comments\\":{\\"data\\":[{\\"created_time\\":\\"2018-07-19T04:08:54+0000\\",\\"like_count\\":0,\\"message\\":\\"I wish Dick&#039;s sporting goods did that for me or Lyft too #crownvicisdone2018\\",\\"comment_count\\":0,\\"id\\":\\"2561218643904116_2561427297216584\\"}],\\"paging\\":{\\"cursors\\":{\\"before\\":\\"WTI5dGJXVnVkRjlqZAFhKemIzSTZANalUyTVRReU56STVOekl4TmpVNE5Eb3hOVE14T1Rjek16TTAZD\\",\\"after\\":\\"WTI5dGJXVnVkRjlqZAFhKemIzSTZANalUyTVRReU56STVOekl4TmpVNE5Eb3hOVE14T1Rjek16TTAZD\\"}},\\"summary\\":{\\"order\\":\\"chronological\\",\\"total_count\\":1,\\"can_comment\\":false}},\\"attachments\\":{\\"media\\":{\\"image\\":{\\"height\\":630,\\"src\\":\\"https:\\\\/\\\\/scontent.xx.fbcdn.net\\\\/v\\\\/t45.1600-4\\\\/c34.0.630.630\\\\/p640x640\\\\/37166688_23842908892450567_5938098054031736832_n.png?_nc_cat=0&oh=9a9090c11403073d5d0dff1ce1598de1&oe=5C12BA99\\",\\"width\\":630}},\\"type\\":\\"share\\"},\\"shares\\":null,\\"who_post\\":{\\"picture\\":{\\"data\\":{\\"height\\":50,\\"is_silhouette\\":false,\\"url\\":\\"https:\\\\/\\\\/scontent.xx.fbcdn.net\\\\/v\\\\/t1.0-1\\\\/c18.18.230.230\\\\/s50x50\\\\/67532_650486158310717_606530372_n.jpg?_nc_cat=0&oh=68123898fb53cd2e3b109f6889bcc2f9&oe=5C041DB5\\",\\"width\\":50}},\\"name\\":\\"AC Auto\\",\\"link\\":\\"https:\\\\/\\\\/www.facebook.com\\\\/ACAutoWakefield\\\\/\\",\\"id\\":\\"114478575244814\\"}}]\',\t\t\t\t\t\t\t\t\t\t\tgraph_url_0 = \'https://graph.facebook.com/{FB_ID}/{EDGE}?access_token=1907658946156725|772c0f8e45a3e7ce70e66a93763e3c1e&{FIELDS}{OTHER}\';\t\t\t\t\t\t\t\t\t\tffwd_fill_likes_blog_style(JSON.parse(id_object_id_0), \'0\', owner_info_0, ffwd_params_0, graph_url_0);\t\t\t\t\t\t\t\t\t     \t\t\t\tfunction spider_page_0(cur, x, y, load_more) {\t\t\t\t\tif (typeof load_more == "undefined") {\t\t\t\t\t\tvar load_more = false;\t\t\t\t\t}\t\t\t\t\tif (jQuery(cur).hasClass(\'disabled\')) {\t\t\t\t\t\treturn false;\t\t\t\t\t}\t\t\t\t\tvar items_county_0 = 1;\t\t\t\t\tswitch (y) {\t\t\t\t\t\tcase 1:\t\t\t\t\t\t\tif (x >= items_county_0) {\t\t\t\t\t\t\t\tdocument.getElementById(\'page_number_0\').value = items_county_0;\t\t\t\t\t\t\t}\t\t\t\t\t\t\telse {\t\t\t\t\t\t\t\tdocument.getElementById(\'page_number_0\').value = x + 1;\t\t\t\t\t\t\t}\t\t\t\t\t\t\tbreak;\t\t\t\t\t\tcase 2:\t\t\t\t\t\t\tdocument.getElementById(\'page_number_0\').value = items_county_0;\t\t\t\t\t\t\tbreak;\t\t\t\t\t\tcase -1:\t\t\t\t\t\t\tif (x == 1) {\t\t\t\t\t\t\t\tdocument.getElementById(\'page_number_0\').value = 1;\t\t\t\t\t\t\t}\t\t\t\t\t\t\telse {\t\t\t\t\t\t\t\tdocument.getElementById(\'page_number_0\').value = x - 1;\t\t\t\t\t\t\t}\t\t\t\t\t\t\tbreak;\t\t\t\t\t\tcase -2:\t\t\t\t\t\t\tdocument.getElementById(\'page_number_0\').value = 1;\t\t\t\t\t\t\tbreak;\t\t\t\t\t\tdefault:\t\t\t\t\t\t\tdocument.getElementById(\'page_number_0\').value = 1;\t\t\t\t\t}\t\t\t\t\tffwd_frontend_ajax(\'ffwd_front_form_0\', \'0\', \'ffwd_standart_objcets_cont_0\', \'0\', \'\', \'album\', 0, \'\', \'\', load_more);\t\t\t\t}\t\t\t\tjQuery(document).ready(function() {\t\t\t\t\tjQuery(\'.first-page-0\').on(\'click\', function() {\t\t\t\t\t\tspider_page_0(this, 1, -2);\t\t\t\t\t});\t\t\t\t\tjQuery(\'.prev-page-0\').on(\'click\', function() {\t\t\t\t\t\tspider_page_0(this, 1, -1);\t\t\t\t\t\treturn false;\t\t\t\t\t});\t\t\t\t\tjQuery(\'.next-page-0\').on(\'click\', function() {\t\t\t\t\t\tspider_page_0(this, 1, 1);\t\t\t\t\t\treturn false;\t\t\t\t\t});\t\t\t\t\tjQuery(\'.last-page-0\').on(\'click\', function() {\t\t\t\t\t\tspider_page_0(this, 1, 2);\t\t\t\t\t});\t\t\t\t\tjQuery(\'.ffwd_load_btn_0\').on(\'click\', function() {\t\t\t\t\t\tspider_page_0(this, 1, 1, true);\t\t\t\t\t\treturn false;\t\t\t\t\t});\t\t\t\t});\t\t\t         \t\t\tfunction ffwd_gallery_box_0(image_id) {\t\t\t\tffwd_createpopup(\'https://acautoma.com/wp-admin/admin-ajax.php?action=PopupBox&current_view=0&fb_id=1&theme_id=0&open_with_fullscreen=0&open_with_autoplay=0&image_width=800&image_height=600&image_effect=fade&enable_image_filmstrip=0&image_filmstrip_height=70&enable_comments=1&enable_likes=1&enable_shares=1&enable_author=1&enable_name=1&enable_place_name=1&enable_message_desc=1&enable_image_ctrl_btn=1&enable_image_fullscreen=1&enable_object_info=0&slideshow_interval=5&enable_image_facebook=0&enable_image_twitter=0&enable_image_google=0&current_url&image_id=257&image_id=\' + image_id + \'&content_type=timeline\', \'0\', \'800\', \'600\', 1, \'testpopup\', 5);\t\t\t}\t\t\tfunction ffwd_document_ready_0() {\t\t\t\t\t\t\t\tjQuery("body").on("click", ".ffwd_lightbox_0", function () {\t\t\t\t    if(jQuery(this).attr("data-type")==\'video\')                    {                        return true;                    }\t\t\t\t\tffwd_gallery_box_0(jQuery(this).attr("data-id"));\t\t\t\t\treturn false;\t\t\t\t});\t\t\t\t\t\t\t}\t\t\tjQuery(document).ready(function () {\t\t\t\tffwd_document_ready_0();\t\t\t\tjQuery(\'body\').on(\'click\', \'.ffwd_see_more_message\', function(e) {\t\t\t\t\te.preventDefault();\t\t\t\t\tjQuery(this).parent().find(\'.ffwd_blog_style_object_message_hide\').css(\'display\', \'inline\');\t\t\t\t\tjQuery(this).html(\'See less\').removeClass(\'ffwd_see_more_message\').addClass(\'ffwd_see_less_message\');\t\t\t\t\tjQuery(this).parent().find(\'.more_dotes\').css(\'display\', \'none\');\t\t\t\t});\t\t\t\tjQuery(\'body\').on(\'click\', \'.ffwd_see_less_message\', function(e) {\t\t\t\t\te.preventDefault();\t\t\t\t\tjQuery(this).parent().find(\'.ffwd_blog_style_object_message_hide\').css(\'display\', \'none\');\t\t\t\t\tjQuery(this).html(\'See more\').removeClass(\'ffwd_see_less_message\').addClass(\'ffwd_see_more_message\');\t\t\t\t\tjQuery(this).parent().find(\'.more_dotes\').css(\'display\', \'inline\');\t\t\t\t});\t\t\t\tjQuery(\'body\').on(\'click\', \'.ffwd_see_more_description\', function(e) {\t\t\t\t\te.preventDefault();\t\t\t\t\tjQuery(this).parent().find(\'.ffwd_blog_style_object_description_hide\').css(\'display\', \'inline\');\t\t\t\t\tjQuery(this).html(\'See less\').removeClass(\'ffwd_see_more_description\').addClass(\'ffwd_see_less_description\');\t\t\t\t\tjQuery(this).parent().find(\'.more_dotes\').css(\'display\', \'none\');\t\t\t\t});\t\t\t\tjQuery(\'body\').on(\'click\', \'.ffwd_see_less_description\', function(e) {\t\t\t\t\te.preventDefault();\t\t\t\t\tjQuery(this).parent().find(\'.ffwd_blog_style_object_description_hide\').css(\'display\', \'none\');\t\t\t\t\tjQuery(this).html(\'See more\').removeClass(\'ffwd_see_less_description\').addClass(\'ffwd_see_more_description\');\t\t\t\t\tjQuery(this).parent().find(\'.more_dotes\').css(\'display\', \'inline\');\t\t\t\t});\t\t\t\tjQuery(\'body\').on(\'click\', \'.ffwd_view_more_comments\', function(e) {\t\t\t\t\te.preventDefault();\t\t\t\t\tjQuery(this).parent().parent().parent().find(\'.ffwd_comment_0\').css(\'display\', \'block\');\t\t\t\t\tjQuery(this).html(\'\');\t\t\t\t});\t\t\t\tjQuery(\'body\').on(\'click\', \'.ffwd_comment_replies_label_0\', function(e) {\t\t\t\t\te.preventDefault();\t\t\t\t\tjQuery(this).parent().find(\'.ffwd_comment_replies_content_0\').css(\'display\', \'block\');\t\t\t\t\tjQuery(this).remove();\t\t\t\t});\t\t\t\tjQuery(\'body\').on(\'click\', \'.ffwd_view_on_facebook_0\', function(e) {\t\t\t\t\te.stopPropagation();\t\t\t\t});\t\t\t\tjQuery(\'body\').on(\'click\', \'.ffwd_title_spun1_0\', function(e) {\t\t\t\t\te.preventDefault();\t\t\t\t\tvar ffwd_comments = jQuery(this).parent().find(\'.ffwd_comments_0\');\t\t\t\t\tif(ffwd_comments.children().length == 0) return;\t\t\t\t\tif(ffwd_comments.css(\'display\') == \'none\')\t\t\t\t\t\tffwd_comments.slideDown(500);\t\t\t\t\telse\t\t\t\t\t\tffwd_comments.slideUp(500);\t\t\t\t});\t\t\t\tjQuery(\'body\').on(\'click\', \'.ffwd_share_button_0\', function(e) {\t\t\t\t\te.stopPropagation();\t\t\t\t});\t\t\t\tjQuery(window).resize(function() {\t\t\t\t\tffwd_blog_style_resize(ffwd_params_0, \'0\')\t\t\t\t});\t\t\t});\t\t                                                          NASA is reinventing the wheel for space and it\'s wild.']
deal, ['Very easy to deal with.']
sale, ["I will not hesitate to call John next time− William S\xa0\xa0Don't forget these guys do used auto sales.", 'Keep our number handy \\\\n781-245-2468.\\\\n\\\\nhttps:\\\\/\\\\/www.facebook.com\\\\/HOWESTOWING\\\\/\\",\\"comment_count\\":1,\\"id\\":\\"2567796679912979_2567841666575147\\"},{\\"created_time\\":\\"2018-07-22T02:27:02+0000\\",\\"like_count\\":1,\\"message\\":\\"I only hydrolocked 1 car on new salem st\\",\\"comment_count\\":0,\\"id\\":\\"2567796679912979_2567872599905387\\"},{\\"created_time\\":\\"2018-07-22T03:29:48+0000\\",\\"like_count\\":0,\\"message\\":\\"I like how you can see the passenger like WHAT DID YOU JUST DO JOHN\\",\\"comment_count\\":0,\\"id\\":\\"2567796679912979_2567982003227780\\"},{\\"created_time\\":\\"2018-07-22T12:27:34+0000\\",\\"like_count\\":1,\\"message\\":\\"Haha\\",\\"comment_count\\":0,\\"id\\":\\"2567796679912979_2568781449814502\\"},{\\"created_time\\":\\"2018-07-22T12:56:29+0000\\",\\"like_count\\":1,\\"message\\":\\"We\\\\u2019re is that video from I want to try \\\\ud83d\\\\ude00\\\\ud83d\\\\ude00\\\\ud83d\\\\ude00\\",\\"comment_count\\":0,\\"id\\":\\"2567796679912979_2568826189810028\\"},{\\"created_time\\":\\"2018-07-22T19:30:14+0000\\",\\"like_count\\":0,\\"message\\":\\"You can&#039;t fix stupid !', 'Cloudflare Ray ID: 5408dc47cde6bd49\n•\nYour IP: 130.64.25.60\n•\nPerformance & security by Cloudflare\nGEM AUTO PARTS is your full service auto parts supplier, committed to providing our clients with a full range of aftermarket parts needs, maintenance and diagnostic equipment, and a dedicated team of knowledgeable sales and service personnel.', 'If you come across any pricing that doesn’t seem right, contact a Store Manager or one of the owners.As a wholesale customer of Gem Auto Parts, you have the option of calling your orders into our VIP center, no matter where your business is located.']
